{
  "schema_version": "1.0.0",
  "content_id": "FL-TEST-A",
  "brief_sha256": "d9348d247ff617fa2ea7082c4b268b5632a90226681701451680c9357f7e81c8",
  "seo_policy_version": "seo-policy-0.1.0-draft",
  "core_answer": "変えたい条件、残したい条件、まだ確認していないことを書き分け、そのうち一つを確かめる。退職や応募を今日の結論にする必要はない。",
  "access_type": "FREE",
  "access_rationale": "基本の疑問と最初の行動を無料本文で完結させる。SEO流入は狙いであり実績ではない。",
  "sections": [
    {
      "heading_level": "h2",
      "heading": "困った場面から、変えたい条件を取り出す",
      "purpose": "読者が判断と行動を具体化するための説明と仮例",
      "source_requirement": "ai_structurable",
      "evidence_refs": [
        "GR001"
      ]
    },
    {
      "heading_level": "h2",
      "heading": "分からないことを一つだけ確かめる",
      "purpose": "読者が判断と行動を具体化するための説明と仮例",
      "source_requirement": "ai_structurable",
      "evidence_refs": [
        "GR001"
      ]
    },
    {
      "heading_level": "h2",
      "heading": "次の判断をするためのメモを残す",
      "purpose": "読者が判断と行動を具体化するための説明と仮例",
      "source_requirement": "ai_structurable",
      "evidence_refs": [
        "GR001"
      ]
    }
  ],
  "evidence_needed": [
    {
      "requirement": "ジャンル別役割は公開用Content Intelligenceを参照。本文の仮例と手順は今回の編集提案として示し、効果実証を主張しない。",
      "claim_kind": "HYPOTHESIS",
      "source_ref": "GR001",
      "status": "available"
    }
  ],
  "personal_experience_needed": {
    "required": false,
    "source_ref": null,
    "status": "not_required",
    "handling": "筆者・顧客の実体験を使わず、具体例は架空の説明用と明示する。A06通常運用の独自素材要件は未解消。"
  },
  "internal_link_candidates": [
    {
      "target_content_id": "FL-TEST-C",
      "target_url": null,
      "anchor_text": "転職を考える人の90日ワーク――条件、試行、見直しを一冊に残す",
      "rationale": "基本整理と継続ワークを必要に応じて行き来する",
      "direction": "outbound_from_this_page",
      "status": "candidate"
    }
  ],
  "cta": {
    "type": "related_content",
    "destination": null,
    "placement": "本文で回答した後の末尾",
    "copy_direction": "任意の次の行動。未確認のサービスや公開URLを実在と断定しない。",
    "status": "candidate"
  },
  "writing_rules_reference": "docs/editorial/ARTICLE_PRODUCTION_RULES.md",
  "publication_allowed": false,
  "human_approval": null,
  "writing_rules_sha256": "ddd1bac7d7b6bbe30972f96bbabb16f2d7b45931d884d12325e573197dcc2396"
}
